Adult Mental Health,An Introduction to Coping with Health Anxiety,9781845292874
Adult Mental Health,An Introduction to Coping with Phobias,9781845292898
Adult Mental Health,Break Free from OCD: Overcoming Obsessive Compulsive Disorder with CBT,9780091939694
Adult Mental Health,Chronic Fatigue Syndrome (second edition),9780199233168
Adult Mental Health, Feel the Fear and Do it Anyway: The Phenomenal Classic That Has Changed the Lives of Millions,9780091907075
Adult Mental Health,Getting Better Bit(e) by Bit(e): A Survival Kit for Sufferers of Bulimia Nervosa and Binge Eating Disorders,9780863773228
Adult Mental Health,How to Stop Worrying,9781847090898
Adult Mental Health,Manage Your Stress for a Happier Life,9781444107418
Adult Mental Health,Mind Over Mood: Change How You Feel by Changing the Way You Think,9780898621280
Adult Mental Health,Mind Over Mood: Change How You Feel by Changing the Way You Think (new edition),9781462520428
Adult Mental Health,Overcoming Anger and Irritability: A Self-help Guide Using Cognitive Behavioural Techniques,9781849011310
Adult Mental Health,Overcoming Anger and Irritability: A Self-help Guide Using Cognitive Behavioural Techniques (new editions),9781472120229
Adult Mental Health,"Overcoming Anxiety, Stress and Panic: A Five Areas Approach",9781444163148
Adult Mental Health,Overcoming Anxiety: A Self-help Guide Using Cognitive Behavioural Techniques,9781849010719
Adult Mental Health,Overcoming Binge Eating (first edition),9780898621792
Adult Mental Health,Overcoming Binge Eating: The Proven Programme to Learn Why You Binge and How You Can Stop (second edition) - hard back ,9781462510443
Adult Mental Health,Overcoming Binge Eating: The Proven Programme to Learn Why You Binge and How You Can Stop (second edition) - soft back ,9781572305618
Adult Mental Health,Overcoming Bulimia Nervosa and Binge Eating: A Self-help Guide Using Cognitive Behavioural Techniques,9781849010757
Adult Mental Health,Overcoming Bulimia Nervosa and Binge Eating: A Self-help Guide Using Cognitive Behavioural Techniques,9781459658561
Adult Mental Health,Overcoming Chronic Fatigue: A Self-help Guide to Using Cognitive Behavioural Techniques,9781849011327
Adult Mental Health,Overcoming Chronic Pain: A Self-Help Guide Using Cognitive Behavioural Techniques,9781841199702
Adult Mental Health,Overcoming Depression and Low Mood: A Five Areas Approach (third edition),9781444167481
Adult Mental Health,Overcoming Depression: A Self-help Guide Using Cognitive Behavioural Techniques,9781849010665
Adult Mental Health,Overcoming Depression: A Self-help Guide Using Cognitive Behavioural Techniques (large print),9781459642850
Adult Mental Health,Overcoming Health Anxiety: A Self-Help Guide Using Cognitive Behavioural Techniques,9781845298241
Adult Mental Health,Overcoming Health Anxiety: A Self-Help Guide Using Cognitive Behavioural Techniques (large print),9781459642898
Adult Mental Health,Overcoming Insomnia and Sleep Problems:  Self-Help Guide Using Cognitive Behavioural Techniques,9781845290702
Adult Mental Health,Overcoming Low Self-esteem: A Self-Help Guide Using Cognitive Behavioural Techniques,9781849010689
Adult Mental Health,Overcoming Low Self-esteem: A Self-Help Guide Using Cognitive Behavioural Techniques (second edition),9781472119292
Adult Mental Health,Overcoming Obsessive Compulsive Disorder: A Self-Help Guide Using Cognitive Behavioural Techniques,9781849010726
Adult Mental Health,Overcoming Obsessive Compulsive Disorder: A Self-Help Guide Using Cognitive Behavioural Techniques (second edition),9781472136015
Adult Mental Health,Overcoming Relationship Problems: A Self-Help Guide Using Cognitive Behavioural Techniques,9781845290665
Adult Mental Health,Overcoming Social Anxiety and Shyness: A Self-Help Guide Using Cognitive Behavioural Techniques,9781849010009
Adult Mental Health,Overcoming Social Anxiety and Shyness: A Self-Help Guide Using Cognitive Behavioural Techniques (second edition),9781472120434
Adult Mental Health,"Panic Attacks: What They Are, Why They Happen and What You Can Do About Them",9780007106905
Adult Mental Health,The Feeling Good  Handbook,9780452281325
Adult Mental Health,The Relaxation and Stress Reduction Workbook,9781572245495
Adult Mental Health,The Worry Cure: Stop Worrying and Start Living,9780749927240
Adult Mental Health,Understanding Obsessions and Compulsions,9780859696524